FeedbackID,WebAppID,CategoryID,SubjectCleaned,MainTextCleaned,SubjectSpam,MainTextSpam,SpamStatus,Subjectivity,Polarity,TextTokens,Text
8000,99,4,Why does pandas apply calculate twice,In the current implementation apply calls func twice on the first column row to decide whether it can take a fast or slow code path This can lead to unexpected behavior if func has side effects as they will take effect twice for the first column row ,0,0,0,2,2,"['pandas', 'apply', 'calculate', 'twice', 'current', 'implementation', 'apply', 'call', 'func', 'twice', 'column', 'row', 'decide', 'fast', 'slow', 'code', 'path', 'lead', 'unexpected', 'behavior', 'func', 'effect', 'effect', 'twice', 'column', 'row']",Why does pandas apply calculate twice In the current implementation apply calls func twice on the first column row to decide whether it can take a fast or slow code path This can lead to unexpected behavior if func has side effects as they will take effect twice for the first column row
8001,99,4,The DNS Server allows zone transfers ,The DNS server on gala giac org allows DNS zone transfers to be performed This was tested with Nessus and verified by reviewing etc named conf see listing in 4 3 1 3 SANS Top 20 U1 ,2,2,2,2,2,"['DNS', 'Server', 'allow', 'zone', 'transfer', 'DNS', 'server', 'gala', 'giac', 'org', 'allow', 'DNS', 'zone', 'transfer', 'perform', 'test', 'Nessus', 'verify', 'review', 'etc', 'name', 'conf', 'list', '4', '3', '1', '3', 'sans', '20', 'u1']",The DNS Server allows zone transfers  The DNS server on gala giac org allows DNS zone transfers to be performed This was tested with Nessus and verified by reviewing etc named conf see listing in 4 3 1 3 SANS Top 20 U1
8002,99,2,Anonymous logins to the FTP server are disabled ,FTP server is being used to allow remote writers of fortune cookies fortunes to transfer their work to the company headquarters and allow remote sales representatives to access information and data The writers and sales personnel currently log in to the server using usernames and passwords SANS Top 20 U5 ,0,0,0,2,2,"['anonymous', 'login', 'FTP', 'server', 'disable', 'FTP', 'server', 'allow', 'remote', 'writer', 'fortune', 'cookie', 'fortune', 'transfer', 'work', 'company', 'headquarter', 'allow', 'remote', 'sale', 'representative', 'access', 'datum', 'writer', 'sale', 'personnel', 'currently', 'log', 'server', 'username', 'password', 'sans', '20', 'u5']",Anonymous logins to the FTP server are disabled  FTP server is being used to allow remote writers of fortune cookies fortunes to transfer their work to the company headquarters and allow remote sales representatives to access information and data The writers and sales personnel currently log in to the server using usernames and passwords SANS Top 20 U5
8003,99,2,The POP3 and IMAP mail servers allow unencrypted logons ,The Postfix SMTP server and Cyrus IMAP POP3 server are not SSL enabled All of these protocols are clear text and any login to these servers requires that the username and password cross the network in plain text SANS Top 20 U5 ,0,0,0,2,2,"['POP3', 'IMAP', 'mail', 'server', 'allow', 'unencrypted', 'logon', 'Postfix', 'SMTP', 'server', 'Cyrus', 'IMAP', 'POP3', 'server', 'SSL', 'enable', 'protocol', 'clear', 'text', 'login', 'server', 'require', 'username', 'password', 'cross', 'network', 'plain', 'text', 'sans', '20', 'u5']",The POP3 and IMAP mail servers allow unencrypted logons  The Postfix SMTP server and Cyrus IMAP POP3 server are not SSL enabled All of these protocols are clear text and any login to these servers requires that the username and password cross the network in plain text SANS Top 20 U5
8004,99,4,How do I import an SQL file using the command line in MySQL ,Be sure to check that the backup file does not have use 'original db' in it Although i specified restore to new DB mysql new db dump sql the sql dump file had that in and it overwrote my live DB Not sure if there is an option to force it to use the DB specified and disregard the use 'original db' in the sql file,2,2,2,2,2,"['import', 'SQL', 'file', 'command', 'line', 'MySQL', 'sure', 'check', 'backup', 'file', 'use', 'original', 'db', 'specify', 'restore', 'new', 'DB', 'mysql', 'new', 'db', 'dump', 'sql', 'sql', 'dump', 'file', 'overwrote', 'live', 'DB', 'sure', 'option', 'force', 'use', 'DB', 'specify', 'disregard', 'use', 'original', 'db', 'sql', 'file']",How do I import an SQL file using the command line in MySQL  Be sure to check that the backup file does not have use 'original db' in it Although i specified restore to new DB mysql new db dump sql the sql dump file had that in and it overwrote my live DB Not sure if there is an option to force it to use the DB specified and disregard the use 'original db' in the sql file
