Id,Subject,MainText
99_4251_4,information giving,e and I create out wedding and wish lists so we know what to get each other for Xmas and bdays 
99_4252_4,information giving,Also helping create our bucket list 
99_4253_4,information giving,Like how it s gotten easier for me to navigate through 
99_4254_5,feature request,I just don t like all the notifications for everything but other than that it s awesome 
99_4255_4,information giving,Downloaded a few days ago and haven t had any issues 
99_4256_4,information giving, you even made me a better cook 
99_4257_5,feature request,I would like to see more categories for browsing it seems all of the DIY Crafts that are lumped together could be better sub divided 
99_4258_5,feature request,Quilts for instance should have their own category 
99_4259_4,information giving,It s like a magazine that you get to design yourself 
99_4260_5,feature request,Instead of just turning the screen orientation the app closes my whole iPad 
99_4261_4,information giving,I would definitely suggest to download it it s only wonderful thing 
99_4262_4,information giving,I have made several projects and recipes from the ideas that have been shared 
99_4263_4,information giving,I m planning my wedding and getting ideas from Pinterest but my mom doesn t know how to use the app so I like sending her pictures from my phone via text 
99_4264_4,information giving,Highly recommend the site and app 
99_4265_5,feature request,The only adjustment I would suggest would be to fix load time as the images sometimes take awhile to upload 
99_4266_4,information giving,I get so many ideas for design and recipes and fun stuff and it also just has a lot of great pictures and it s fun to look around 
99_4267_5,feature request,If I could turn that option off on this app and the site it would be nice 
99_4268_2,problem discovery,Please fix it so that it is compatible 
99_4269_4,information giving,The fact that I can use it on the go just not at home is awesome 
99_4270_4,information giving,Definitely a good app and I ve never had a problem with it 
99_4271_2,problem discovery,It crashes once in a while about two times a week 
99_4272_4,information giving,Please bring that back and keep it 
99_4273_4,information giving,Please bring the old version back 
99_4274_4,information giving,I ve said more than once that Every woman should have a Pinterest account 
99_4275_4,information giving,I defiantly recommend downloading this app 
99_4276_4,information giving,I had to Google it to discover that you have to tap the camera button then the little image icon 
99_4277_4,information giving,I was confused of how to use it at first but now that I ve figured it out its terribly addicting 
99_4278_2,problem discovery,The old app was constantly crashing and shutting my ipad completely off 
99_4279_5,feature request,Please bring back the A Z tabs when looking for categorized pin boards 
99_4280_4,information seeking,I could spend hours on it and yet I still don t know quite how to use it 
99_4281_4,information giving,This app is amazing and always provides me with new ideas for everything 
99_4282_2,problem discovery,Previously the app would crash my iPad and though it still does this it s far and few between crashes 
99_4283_4,information giving,Tried trouble shooting and they said sorry that s just what you have to do sometimes 
99_4284_2,problem discovery,I love Pinterest but it always crashes 
99_4285_4,information giving,If you post your own stuff Pinterest automatically owns it 
99_4286_2,problem discovery,I love the app in general but this update has some bugs 
99_4287_4,information giving,Used it to plan my daughters wedding makes me a rock star when I bake or entertain helped me redo my dining room table and a whole lot more 
99_4288_4,information seeking,What did I do before Pinterest 
99_4289_4,information giving,What a great way to discover how to enhance your life in all areas 
99_4290_4,information seeking,Wish the app was available on my Philips smart tv 
99_4291_2,problem discovery,I love this app but it crashes all the time 
99_4292_4,information giving,I utilize recipes DIY projects travel ideas and many other options available 
99_4293_4,information giving, HIGHLY recommend it 
99_4294_5,feature request,While Pinterest is still a great idea the fact that the home feed is now more than 50 related pins is very annoying 
99_4295_2,problem discovery,Enjoy using on my iPhone and iPad but it still likes to crash 
99_4296_2,problem discovery,When I try to load a video it almost always crashes 
99_4297_4,information seeking,Why limit to 3 
99_4298_4,information giving,I love the new functionalities available in this release 
99_4299_4,information giving,I love all of the updates that they have had on it so far Pinterest has everything that you could possibly think of and I recommend Pinterest to everyone 
99_4300_4,information seeking,How did people organize their weddings before Pinterest 
99_4301_5,feature request,Wish there were more secret boards available 
99_4302_2,problem discovery,I like sharing info and ideas with others however the lack of privacy is an issue 
99_4303_5,feature request,So I d like more privacy settings that are already available on other social networking sites and Pinterest would be perfect 
99_4304_4,information seeking,How do I go back and submit my email address so I can write comments 
99_4305_4,information seeking,I don t know how to go back to where you tell me to give my email address 
99_4306_4,information seeking,Is there a way I can leave messages to other pinners 
99_4307_4,information giving,It s such a fun place to visit when I need a new idea or different perspective 
99_4308_4,information giving,I love this app it is my go to when I need some creative direction 
99_4309_4,information giving, nEveryone can use this app 
99_4310_4,information giving,You seriously just tap the pic and in seconds it s on one of your perfect boards 
99_4311_4,information giving,I recommend this to anyone looking for inspiration 
99_4312_5,feature request,But you should add chatting 
99_4313_5,feature request,Wish I could select multiple pins when I need to edit my boards 
99_4314_4,information giving,Plus it holds well on my 4G iPod and I haven t had a single problem with the app in these past couple of months since using it 
99_4315_4,information giving,If you love to pin and pin quickly then I d recommend downloading the app 
99_4316_4,information giving,Haven t had any real issues with it 
99_4317_4,information giving,Pinterest doesn t need my review to convince anyone of its worth and ease of use just try it yourself 
99_4318_4,information giving,Pinterest is addicting can t wait to see how it keeps getting better 
99_4319_4,information giving,Great app live convience of just pushing a button instead of browser hunting 
99_4320_4,information giving,You did an update to fix bugs but seemed to have created new ones 
99_4321_4,information giving,I love that I can create my own boards and use Pinterest to organize holiday and party planning 
99_4322_4,information giving,I really recommend this app 
99_4323_4,information giving,Watch out because once you start you might get addicted 
99_4324_4,information giving,The only thing I would warn is that you can probably become a bit materialistic 
99_4325_4,information giving,So be happy with what you have and just have fun 
99_4326_2,problem discovery,Prior to the update it was crashing frequently shutting down my iPad then rebooting 
99_4327_5,feature request,Please bring back this feature 
99_4328_5,feature request,I only wish that you could remove previous pins from a board or move them to a different board just so you can correct a finger slip or get rid of things that you didn t end up liking 
99_4329_2,problem discovery,App fails in iPod works great in iPad 
99_4330_4,information giving,Nik Nik 888 Just love this app nIt s very inspirational when you need a pick me up 
99_4331_2,problem discovery,Although more often Puns don t always link back to the original post where you can find the recipe or instructions on how to do make something 
99_4332_4,information seeking,Why do I need to pay all of a sudden 
99_4333_5,feature request,getting lower and we still pay for it Please make the picture view adjustable since lage device took roll 
99_4334_4,information seeking,Why on earth do i never recieve notifications from this app 
99_4335_4,information seeking,I ve checked my settings a thousand times everything is great there but why dont i recieve notifications 
99_4336_4,information giving,Most necessary app Its simply pointless purchasing a smartphone that does not support whatsapp 
99_4337_5,feature request,Need to see contacts profile pictures Need to fix the problem where people can see their contacts pictures
99_4338_2,problem discovery,I am not able to add any nor view any which have UTF8 chars in the name 
99_4339_5,feature request,Good app but wont let me get wifi please make it on a tablet 
99_4340_4,information giving,status suggestion feature can hav random quotes available means by refreshing it can show a new quote after all ur app sounds like wassup but u deserve 5 stars 
99_4341_5,feature request,But why not a new design 
99_4342_2,problem discovery,Zero start Fail to load Continuously hangs and I can t open this app 
99_4343_5,feature request,Just remove the last seen record 
99_4344_4,information giving,Good application This is fast and provides data immediately 
99_4345_4,information giving,hope the makers will have a look on it too in the coming updates 
99_4346_5,feature request,Really appreciate What is a very wonderful chattin network indeed it might help to chat with friends wherever u want but beware thre is a drawback that you must connect to a wifi network
99_4347_4,information giving,We can use it for many things It is good but it take many internet
99_4348_5,feature request,Bhknb Y this application is not working properly on my phone
99_4349_4,information seeking,Not fair As much as I love to use Whatsapp I am wondering why my version of Whatsapp only has one year limit while my friend has unlimited usage 
99_4350_5,feature request,please increase data limit more than 12 m b kuldeep 
99_4351_5,feature request,Please The Profile pic I don t want To anyone to see it Anyone i don t know but have my number 
99_4352_4,information seeking,Why it s works slowely 
99_4353_2,problem discovery,Comm made easy Updating is the only problem 
99_4354_5,feature request,Bug should be fixed I like this app but Its continuously giving error and stopped crashing please fix this bug 
99_4355_5,feature request,needs to be made free need to be made free for 5 stars
99_4356_5,feature request,Keeps crashing Not only did it crash it also wiped my whole phone 
99_4357_5,feature request,new update is worse I am using it on note3 and ever since I updated the new version I am unable to send songs to my contacts 
99_4358_5,feature request,privacy is another issue 
99_4359_5,feature request,Crashing It crashed 2 times in 10 minutes 
99_4360_4,information giving,Nice app Good work bt stil needs improvement
99_4361_4,information seeking,Very good app I wish it can work with two number in same phone or work with dual sim card for both number when it will be Work for dual sim card mobile plz 
99_4362_2,problem discovery,Bakwas application Always not responding problem occurs can t shows messages 
99_4363_4,information giving,Ma fav I just love it
99_4364_2,problem discovery,But the problem is very slow running to update 
99_4365_5,feature request,But I d suggest two important features which are available in many other messengers 
99_4366_4,information seeking,Why this is available on iOS while it s not on android 
99_4367_5,feature request,This must be added common 
99_4368_2,Almost perfect,Besides the occasional crash this is an amazing product with tons of potential depending on how you work with it 
99_4369_2,Take a photo of your boarding pass,This could be a great app if it was predictable but it is full of bugs and is unpredictable if you are able to check in take a screen shot of your boarding pass or print a backup copy because you may not be able to access it when you need it most 
99_4370_2,Won't open due to pop ups since upgrade,I can't open since the last 2 updates Pop ups go crazy on the iPhone 5 I'm uninstalling
99_4371_2,Not Working After Update,Use to love this app but it's not working after new update Pages won't scroll up or down none of the different tabs work it's frozen Please fix ASAP 
99_4372_2,problem discovery,Urrrrm After my third re installing it finally has scenery Before hand it was just black shapes everywhere I could not even see the walls This killed my internet as it is a very big game that takes half an hour to install if you don't like the game their is no chance of a refund Once I finally got the proper game it is very pretty with smooth graphics an amazing sound track and some of the best scenery I've ever seen on my tablet In the next update I want to be seeing the right installment first time a chance of a refund and free roam Free roam was the best part of the old games I would love to have it on my tablet Thank you 
99_4373_2,Needs work,This app serves its purpose for me perfectly except for the mobile deposit won't work It keeps saying can't find endorsement After calling PNC multiple times about this still no fix 
99_4374_2,problem discovery,Album function needs improvement Current version opens up all possible folders which includ cache files which should be selectable from settings to avoid unnecessary browsing resulting low productivity 
99_4375_2,Excel files don't open with update ,I'm very disappointed that I can't open most excel files anymore Repeated tries works occasionally but it should work every time 
99_4376_2,problem discovery,NEEDS TO BE UPDATED Was Fun Challenging Desperately in need of an update Paid for the Allie levels SEPTEMBER 1 and still no new levels when is soon No new levels of the week No updates Used to be a favorite 
99_4377_2,It's good to look at stuff,It's good if you want to browse but is horrible at letting me post anything It stays frozen on signing in and I have to close the app 
99_4378_2,Crashes,Crash Crash Crash Crash Crash Get it 
99_4379_2,problem discovery,Was great It was great until apparently it updated on the 27th and now every time I try to use it I get a message the it has stopped working and it force closes Please fix 
99_4380_2,Yup It's ugly,The white app icon is so atrocious I'm hiding it away in a new folder that I'm naming 'Ugly Apps' It will be joined by Photos and iBooks Some other Apple bloat ware apps like Game Center Newsstand and Passbook could go in too but they'll just stay in my 'Crap ' folder instead
99_4381_2,problem discovery,Would like it to have more edit items 
99_4382_2, VERY BAD ,This use to be a great app on iOS 5 Having iOS 7 and the latest version of Dropbox and it's really bad The new UI for viewing photos and video needs improvement to return to the way it was
99_4383_2,Started out great,The app was awesome until the latest update I lost a weeks worth of class notes can't even open the program without it crashing unless I'm connected to wifi and a complete notebook just disappeared after the password reset Everything was great before the update now nothing works
99_4384_2,Crash,After the last update it crashes Please fix 
99_4385_2,PDF Problems,I liked very much the upgrade to pdfs divisions and search However they aren't displaying anymore Fix it and it will be perfect Best wishes
99_4386_2,problem,Can't update your latest bug fix
99_4387_2,It won't let me sing with other people,It says error to collect calls and it won't let me up date anything it needs to be fixed
99_4388_2,problem discovery,ok seriously this app would be great if the timing adjustments weren't so erratic i've made the same exact video a million times and it keeps coming out with an extra 2 seconds here or a bit shorter there throwing off the entire video audio sync
99_4389_2,Dropbox update,The update has been installing for a week
99_4390_2,Hats,I love the app but it's annoying cause when I use the premade hats they come half out with the middle half of the hat gone so I can't make what I want easily 
99_4391_2,problem discovery,Effect Please fix some of your effect such as fattal because its become a different quality of picture when I want to save it Which means what I edit its not the same picture that I save Overall good Just on that part only
99_4392_2,Meh,It's really slow and it always glitches up when I try to delete a stauts or somthing and I can't figure out how to delete pics or make new albums no me gusta
99_4393_2,Problems,Can't use due to pop up about push notifications Open iTunes and connect for notifications HATE IT 
99_4394_2,Waste of time,Won't open Keeps timing out Don't waste your time till they fix the issues 
99_4395_2,Still CAN'T UPLOAD VIDEOS ,COME ON DROPBOX This is getting ridiculous I've uninstalled and reinstalled and it's still stuck Your customer service said this update would fix it 
99_4396_2,Just doesn't work,So frustrated Not responsive or sluggish Cannot modify the city from which I want to rent I give up 
99_4397_2,Buggy,Bookmarks do not work Bookmark your favorite dispensary and it takes you to some other random place The overall performance is buggy and crashes 
99_4398_2,Upgrade causing crashing ,Recent upgrade is causing the app to crash on iPad Needs fixed I have tried to delete and reinstall but that didn't fix the problem
99_4399_2,5 information 1 app,I like Trip Advisor but their app is slow and feels buggy If you have the patience to navigate through its um 'quirks ' then you can get to their good info
99_4400_2,problem discovery,Search doesn't work anymore After the update the search function doesn't work It keeps putting 20's within the search so nothing comes up Please fix otherwise the app is useless if I can't search for anything
99_4401_2,problem discovery,Plz more backgrounds and frame
99_4402_2,iPhone 5s Really ,Did not work on my new iPhone 5s Only showed sliding logo's
99_4403_2,Minor glitches,Pretty good but glitches Wanted to use flight filters but it wasn't applying them Had to start search over Haven't used it much yet
99_4404_2,problem discovery,You need to improve the hebrew editing 
99_4405_2,What happened ,This app used to work so well now it never works Please fix It keeps sending me warning messages 
99_4406_2,Yeah it's cool but ,It seems like a cool app from what I have been able to see It crashes everytime I get it open The free app got me hooked which never crashed Get this fixed please and I will resubmit a review 
99_4407_2,So sad ,I did the update and they made me change my password I logged in with my new password and ALL of my files are missing And then I logged into my account through the website and no notes are there either This is great since midterms are next week and all of my notes are gone ' 
99_4408_2,problem discovery,Needs Update It still needs updates Its a bit slow I hope whatsapp fixes this problem I know they are too busy but they have to take out time for us 
99_4409_2,Great new look But,Keep up the good work but camera upload has stopped working for me No matter what I change no photos or videos will load
99_4410_2,Good luck with mobile deposit,It is useful to check balance and do transfers but mobile deposit simply doesn't work it refuses to see my signature I called support and their suggestions were set camera to highest quality and delete and reinstall app neither of which were any help So now I am stuck mailing the 'For mobile deposit only' check to them hoping that PNC bank by mail works a lot better than this app 
99_4411_2,Crashes all the time,I may give it a way better review when they fix it but EXPECT it to crash ll the time about every 3 4 filters I downloaded it then crashed Frustrating Once it FROZE and I had to delete re install 
99_4412_2,problem discovery,Worst Atleast reply and help Worst since four days trying to register everytime they cut balnce for verification them send voice verification nd then fails that also crap negative star
99_4413_2,Crashes,This latest update did nothing to stop crashes Completely unusable
99_4414_2,Just Awful,Loaded to my iTouch In it Everything is completely opposite East reads as West North reads as South etc Don't get this app unless you want to get lost Will proceed to Delete immediately 
99_4415_2,problem discovery,Become very unstable and unsupported to my device Now a days it gives a big problem for my HTC desire V device whenever someone or group chat text message me in marathi language or used in more smily in that message that time whatsapp is directly closed and suddenly come back to the home screen and never open it
99_4416_2,problem discovery,What the heck Love the program BUT since you added the 'share this pin' option I have been receiving spam that my friends did not send My account was hacked too How about a fix 
99_4417_2,Buggy,In theory it's great but once a PDF is selected it can be impossible to close it I have resorted to tapping relentlessly on my screen so some magic will show the tools The PDF just sits there Way more effective to go through a browser Really Irritating 
99_4418_2,problem discovery,Im a dude Im a dude and i love pinterest The app is little glitchie on Android and iPhone but its getting better
99_4419_2,Crashes every time I try to load 1000 songs ,Doesn't work at all Want my 99 or an app that works 
99_4420_2,Good,I like this game a lot play all the time cannot put down however there is one issue the game lags can you please fix Thanks
99_4421_2,Open in for music files ,Why did you remove open in option for music files I used to be able to do this with my sound files Why 
99_4422_2,problem discovery,I love pinning I love pintrest and this app lets me use it anywhere The only problem I've had is that if i turn my phone sideways the screen gets messed up and i have to exit out of the appplease fix 
99_4423_2,Don't like anymore,Can't easily share composition due to file type 
99_4424_2,Office documents,Use to be good until I cannot open any office documents
99_4425_2,Still lost,Is been downloading for 2 days and still downloading
99_4426_2,problem discovery,its problem is about not being allowed ur last online status
99_4427_2,Great app but one problem with the new update,Great app I love the new design but with the new update when you try to share a link to a specific file that has a space in the file name I have to manually replace the spaces with 20 so it will hyperlink correctly This used to not be a problem Please fix this Other than that one problem this is a great app also I like the fact that if you download a picture from the app onto the iPhone it doesn't auto upload the picture so you have 2 copies of the same photo in the auto upload folder Thank you for that fix Keep up the great work 
99_4428_2,Horrible App Crap ,Crap Doesn't work Try something else Don't waste your time 
99_4429_2,problem discovery,Crashes all the time 
99_4430_2,problem discovery,it is very important to add a landscape sheet orientation and Word Art basic options at least 
99_4431_2,Gets worse with every release,Used to be a good application with ability to search cities you haven't yet reached and filter by rating as well as proximity however those features have been replaced with functionality focused on marketing hotels Don't use this application purchase a good guidebook instead
99_4432_2,Not for texting,Doesn't work for texting You have to update ap or give instructions how it works for text Just one star for trying I'm a texting person But this ap doesn't do that 
99_4433_2,Love ,I love having my nook on my iPad and I love having so many books always with me Sometimes though I wish I could get certain books they don't have 
99_4434_2,problem discovery,Good as an editor but a little slow Yeah It is good but a li'l bit slow
99_4435_2,Wack Google Earth,This App Is Horrible They Need To Update It x5 I Juss Got It And Its Taking Forever For The Features To Load TRASHHHH 
99_4436_2,Was my fave app now crashes and I can't access anything,As recently as last week I used this as almost my central control for everything After the latest upgrades there were issues and now it crashes and I cannot access anything I am left in a very difficult situation Please fix it 
99_4437_2,problem discovery,Great game Was at last able to download it The game is very good graphics are awesome loved it a lot App is really smooth I just wish the upgrades were permanent and the customization was more like the original most wanted and free roam feature is there Rest is perfect 
99_4438_2,Can't read cached PDF,please fix it it's the most often used function for me
99_4439_2,Fix it ,I will give this app a much higher rating if you fix the Larimer County Fire and EMS 
99_4440_2,Problems with this version,Started with app not getting all notes Deleted and reinstalled app Fixed that Now when I select all notes it opens to a specific note and freezes when I try to go back So here I am to try reinstalling again iPhone 5 ios7
99_4441_2,Needs a fix ,I loved this app I used it all the time but after the update it won't get connected And it crashes a lot What's up with that 
99_4442_2,Buggy Worthless but Cool,Love the organization features and style but the bugs make it impossible to use The app isn't worth the money until the bugs are fixed 
99_4443_2,Why did it change ,Why did it update It logged me out and now it took all my books I also haven't found how to buy books Where is the store I need help 
99_4444_2,problem discovery,Great app but I wish I could move pins from one board to another in bulk instead of one by one When I edit my boards it takes too long to move one pin at a time Other than that I love the app
