Id,Subject,MainText
99_5186_4,Great app super useful,I use this app almost every weekend while exploring back roads and trails by motorcycle Functionality is excellent while on the road as well as using the data to review later using Google Earth I've tried all the GPS tracking apps and this is the one I go back to every time I strongly recommend reading the users guide and watching the videos 10 minutes spent learning the app will really pay off in how much use and function you get out of the app 
99_5187_4,Wow what a great update ,I cannot believe how amazing the new changes are If you mountain bike hike camp or travel this is a must need app It now tracks altitude pace speed and about every other stat you need in any unit of measure By far this is the best app I have 
99_5188_4,Good app,Pretty easy to use been using it for over 2 years Easy to learn As new features were added those features made sense 
99_5189_4,Love love love ,This is hands down the most useful app I had the lite version but decided it was worth the money to upgrade It makes it so much easier than the guess and check on the calendar I love it 
99_5190_4,Photographer,Ran side by side with other and this app beat all hands down Needs dedicated space for mileage 
99_5191_4,Great app,Love it's multifunctionality Able to do multiple business and year prior expenses etc 
99_5192_4,Consumer,This ap is great really puts your collection at your fingertips I really like how easy it is to manage your wine collection buying drinking or storage notes Love it 
99_5193_4,Great app ,Works awesome for me Have 1200 cellar of mostly older bottles Scan works a lot but type and search fills in Really live off this app love the drink now feature Use that every week 
99_5194_4,The best,Better than any other wine app 
99_5195_4,Ehh,It is a good app but I eat a lot of home cooked meals and it's hard to find the exact thing I ate 
99_5196_4,Amazing,This app is beast The best thing is is that it doesn't need Internet Because I have an iPod touch so I don't have Internet on it in public I recomend this app 
99_5197_4,Great app,Buy it
99_5198_4,I like,This is a great little app especially for those with hectic schedules it keeps you in like for visual people like me 
99_5199_4,Support my touch ,Live sky does not work on my touch Also doesn't find my correct locAtion So close to being like the Droid app but off by a parsec 
99_5200_4,One of my few must have apps ,I keep tabs on my brother's flight info as he travels for work quite a bit I'm a worrier by nature so it's wonderful to be able to see the progress of his flights I've always been able to pull them up easily they've always been accurate Great job 
99_5201_4,Great app ,Used this app all over the world and it hasn't let me down yet 
99_5202_4,Snow n sun,I take this on the mountain and on the bike trail Continually improving in surprising ways Keep up the great work 
99_5203_4,Pure joy,It's a pure joy already having a pic when your friends call and sometimes contacts info from your FB friends that you haven't taken the time out to acquire Fabulous 
99_5204_4,Love it ,I love the sync bday reminders 
99_5205_4,No complaints,Works just fine 
99_5206_4,Awesomeness ,Great app 
99_5207_4,Works great with iPad,Now that it comes with iPad Keynote integration this app is worthwhile to get My only complaint is that notifications on the iPad interrupt it Which you can fix Apple by improving the notification system cough So get this if you use Keynote 
99_5208_4,Instructions on how to use ,To those concerned that you cannot zoom in on those savvy charts and reference materials included on this app you CAN Let me help Simply tap on the chart or image itself This will then immediately bring it up closer in its own page and then you can get even closer by pinching Just tap the images first my friends This is a great app 
99_5209_4,Boss,At first I didn't have the challenges on and literally got board in about 10min But when I turn the challenges on I was all over it like a hawk of a dead animal So to get to the point BETER THAN MODERN COMBAT 3 
99_5210_4, 3,BEST GAME EVER 
99_5211_4,How to buy packs,I can't find how to buy add ons Plz help other wise great game
99_5212_4,Add girls ,I will give it 5 stars when you add girl pygmies 
99_5213_4,Love this App,Great app to have for tracking flights I own a limousine company all my drivers use it to track their clients flights 
99_5214_4,Great ,Easy to use and very accurate A must for any traveler 
99_5215_4,Amazing ,I just finished up a weekend of playing and it was the first time I have used this product I was more than impressed with it The setlist option was my favorite part We played several different times throughout the weekend and being able to program the songs into setlist form made it super easy to transition between songs I highly recommend this product and can't wait to use it again 
99_5216_4,Easy to use even for non techie Well worth the price ,A must buy 
99_5217_4,Awesome,For the price it's great I've been using quicken for 5 years now but I've switched to this app 2 years ago My wife and I use the sync option and are now keeping a budge very easily Awesome app needs a desktop version 
99_5218_4,The future is now,This app is a fixture in my college studies Good Reader technology turbo charges my research and puts me ahead of the pack I couple it with Instapaper papers and an air printer app or two and the power is in my hands and pocket 
99_5219_4,Great app,I use this app every day on my iPhone 4 and it works perfectly fine 
99_5220_4,Love photos with Bible verses ,I enjoy sending verses to my friends on my iPhone
99_5221_4,Love it ,I love having a new verse pop up every morning Great for on the go and if you're looking for a verse pertaining to a certain category whether it be encouragement patience etc Very convenient And beautiful background pictures 
99_5222_4,So useful for keeping me in track ,I love the convenience I having daily readings right at my fingertips and when I travel to Europe for the semester I don't know if I could live without it 
99_5223_4,IMissal,Great for daily readings I love it 
99_5224_4,Excellent app ,This is an excellent app to use in the daily devotional reading of the mass readings Well done 
99_5225_4,Great app,Overall a great app I use it daily It would be helpful if entrance and communion antiphons were included I do not appreciate the new in app purchase feature The saint of the day should either be included with the program or have a way to remove the buy button for those who do not want to purchase this 
99_5226_4,A Wonderful Spiritual Aid,What a bargain for all the benefits I receive daily from this app The audio is especially good to have Reading or listening to the daily Mass readings has been a great help to me I also like having the prayers for the start and end my day I consider this to be a must have app for all busy Catholics 
99_5227_4,Like a boss,Doodle jump is sick I love it He's so freaking cute 
99_5228_4,Awesome with Quizlet ,I needed a good flash card system for my Mandarin vocabulary and this is everything I could have asked for If never heard of Quizlet before but by enabling the extended keyboard for pinyin and my Simplified Chinese keyboard I was easily able to make a custom list of words shu on one side and water on the other for instance Inputting them to this app was super easy Very well done and totally worth the 4 Quizlet is free by the way 
99_5229_4,Buy this,Pixel for pixel this scanner does better than an expensive HP printer scanner Part of that is the iPhone but the other part is JotNot's software I use this in my presentations for text off a page it doesn't do so well with images though hence the 4 stars taken as a whole it's money well spent 
99_5230_4,Simple Easy,Fantastic app Makes reading forums so much easier that now I find myself doing it more Great 
99_5231_4,Cool,I like a lot
99_5232_4,Love It More Forums Please ,I think this app works better than using my desktop to use forums Fast eat to read searches well Wish it had Miniusa and Bike forums Great for Tacoma World 
99_5233_4,Great App ,If you use forums a lot you'll love this app 
99_5234_4,WhatsApp,Excellent
99_5235_4,The best,The best App ever 
99_5236_4,If you like Craigslist,You'll love Craigslist pro
99_5237_4,Buy It,I have only purchased a few aps but this for sure is one of them 
99_5238_4,Awsome,Awsome
99_5239_4,Missing stuff,There are different categories missing since the update What's wrong with this 
99_5240_4,Awesome ,Sweet app Thank you I love it 
99_5241_4,His royal highness 1V,Awesome 
99_5242_4,Awesome ,Need more for finding rental HOUSES But great other than that 
99_5243_4,Awesome app ,This app is far better than the usual web interface intuitive fast and great graphics 
99_5244_4,Awesome selling and buying tool ,I have sold and bought many things using Craigslist 
99_5245_4,Love it ,This app is just like the website except you have to pick an area instead of having them laid out for you I love this app and use it every day 
99_5246_4,Well designed,Easy to find what you want and narrow the search The photo gallery feature is great when your first filter is how it looks 
99_5247_4,Great,Great
99_5248_4,Craigspro,Freaking great 
99_5249_4,Great ,A 
99_5250_4,Excellent scanner,I have used this for over a year and have never been disappointed The sound quality is excellent on the iPhone 
99_5251_4,Finally,This app rocks 
99_5252_4,Solid,Good app Gets me to the info I want quickly and auto adjusts times to my time zone many apps don't 
99_5253_4,Not one problem with this app,I love this app nothing better for the NASCAR fan 
99_5255_4,Great app for this price,I have been using this product for 5 days and I love it If you are seeking for an app mainly to write school paper do basic spreadsheet and reading PDF articles this is the one Of course you can't compare to iWork apps because they will definitely beat this app in terms of looks and quality called great marketing But if you are a poor student like me paying student loans and are seeking for an app mainly to write papers and read docs I recommend with this one I have not tried the PowerPoint yet so I can't say much about it 
99_5256_4,Mr,I love it
99_5257_4,Not that good,Got this app to be able to share PPT and Word docs Does not support all of the data from those files Not happy with it at all Will try to work with it but I think it was a waste of time and money 
99_5258_4,Great,Great 
99_5259_4,soaring hawk,great app 
99_5260_4,Great app They can't get much better then this one,Highly recommend this app to listen to ATC conversations from around the USA and world
99_5261_4,VERY WELL,VERY WELL
99_5262_4,A ,Great app Works on almost any course No complaints at all 
99_5263_4,Great golf app,Overall fantastic The UI is a little clunky and things like tapping in the golf ball icon to measure club distance were a little tough to find It doesn't look like a button Wish I could view the clubs and look at their performance without starting a round Statistics could use some work as well The charts while fairly easy to read seem disjointed Needs a better social aspect 
99_5264_4,Now with in app stats , Update 149 rounds recorded iPhone 3GS Battery 70 80 left after rounds Still no side game tracking but the notes feature works somewhat for that Finally fivesomes Sixsomes THE BEST APP FOR GOLF 17 rounds under my belt with this app now and still very happy The new in app stats v 1 3 blew me away Still waiting for side games skins etc I'm confused why so many golfers leave their phone on the entire round I pull mine out as I'm walking up to my ball usually while I'm 20 30 yards away I get positive satellite lock by the time I'm standing over the ball read my yardage and put the phone back to sleep After putting I whip it out score the entire foursome takes about 15 seconds total and then put it back to sleep I consistently have 80 85 battery life after my round is complete Once we get side games betting included in a future update I will be even more of a cheerleader for this app Used Golfshot for my last 6 rounds and I will continue to use it forever It's accurate easy to use and being able to email your scorecard to your buddies and review actual stats for yourself are perks I didn't know I wanted but now I can't live without Ended up being cheaper to buy a new iPhone 3GS AND this app than the skycaddie I was looking at Stand alone golf GPS units are in serious trouble 
99_5265_4,Best Golf GPS for the money,I have used this App for over 8 months and is by far the best golf GPS for the money I had a sky caddie before and it was not half as good as this app Don't waste your money on any of the annual dues GPS units buy this app and have everything you need I have the iPhone 4 and only uses about half the battery during a 4 1 2 to 5 1 2 hour round Turn off your Wi fi if it is using more battery life than that Anyway must have for all serious golfers 
99_5266_4,Used nearly every day,This app while not perfect some songs it doesn't is very good I use it severalvtimes a week 
99_5267_4,Great,I use this every night It amazes me how little sleep I get most nights I have made sleeping more of a priority since using it I can see the difference 
99_5268_4,Great ,Just what I wanted to know 
99_5269_4,Very cool ,Provides for hours of uproarious entertainment 
99_5270_4,Amazing,Great app to keep track of hours Especially if you're on salary or budgeting 
99_5271_4,Opiniao,Great 
99_5272_4,Wonderful,Thank you for this great resource and thanks to all the readers Driver
99_5273_4,MD,This a great tool for a rapid lab consultation 
99_5274_4,Wow ,Some stories are just down right terrifying I have had experiences myself So I can relate It's a must buy for your iPad iPhone iPod No joke 
99_5275_4,Awesome App ,I am a very superstitious person I love any kind of ghost story Short Long or a book But this app has everything from short stories to long Definitely worth the 
99_5276_4,Really great app ,I love This app honestly I don't care if there are mistakes in some stories it's normal This is app is great Download now It's worth 99 cents 
99_5277_4,Awesome,Awesome
99_5278_4,Awsome,Ive sent in a story and i know thi app is BEAST 
99_5279_4,Best app EVER ,I'm ten and this stuff does not scare my and I'm 10 YEARS OLD 
99_5280_4,Outstanding ,Recently used in several European cities and it was GREAT 
99_5281_4,I like I like,Well I have used Magellan it was cool and then I bought a navigon that was the biggest waste of 350 dollars of my life then I used sprint navigation that was fairly accurate so there I have had a couple and this is one of my favorite navigation devices the huge difference is the price 99 cents can't be beaten Update to a month and a half later I love this navigation devise have used it more than my factory one I can listen to my music while navigating and it's points of interests rock The turn by turn speech and real time traffic is long gone but I don't miss it at all If I could give this app more stars I would
99_5282_4,needs a few more tweeks,good app but to make it a great app video would be a great feature A must need is to make the timer continuous After the 5 sec countdown it would be great for it to restart automatically for continuous self shots Please add that 
99_5283_4,Drudge review,The best news I always check Drudge first for the rest of the story 
99_5284_4,Works great,Smooth simple app
99_5285_4,Good to share ,It's just getting better and better The signature capture is a huge time saver Ever wonder how to put your contact info from their email into your Contacts just copy their signature into this app it will separate into different fields and put them in your iPhone Contacts How great 
99_5286_4,love it,can't live without my scanners 
99_5287_4,Funny as hell app ,Someecards are super funny They're a great way to give someone a good laugh Sometimes I just like to look through them because they're fun to read 
99_5288_4,Better than typing,Still need to check each I think I need to improve technique Cards with multiple addresses throw it for a loop Very easy to export to excel
99_5289_4,Great app ,That says it all 
99_5290_4,Amazing style ,Love this app Easy way to keep track of what's in my closet and mix and match pieces Even better when I got an iPhone so I could take pictures of my clothes and load directly to the app Perfect for any Fashionista 
99_5291_4,Excellent product God Loves America,Excellent product Continue development of similar programs for other subject areas For instance science history Christianity Pray for God guidance America God bless BP
99_5292_4,Concise and accurate,Great App for Travelers Highly recommend it 
99_5293_4,Convenient App,Fast and convenient app to search for flights
99_5294_4,Kayak,Great app even for smaller regional airports 
99_5295_4,Great app,I use powerOne all the time whether for a simple conversion or working out mortgage payments for a new dream house Highly recommended 
99_5296_4,Best calculator ever ,A well engineered multipurpose calculator If the extensive template library doesn't have what you need you can easily create your own calculators without a steep learning curve As a repeat customer since the Palm handheld days I definitely consider this a great value Keep up the good work 
99_5297_4,A most useful tool ,I find that this app does exactly what I wanted it to do display meaningful data from all the iPhone sensors Very clear and intuitive interface It's really the only tool of it's type I need 
99_5298_4,Wonderful ,Very nice looking app 
99_5299_4,Too too cool ,My only complaint with this otherwise wonderful app is the absence of any warning for the bottomless hole in time this thing hides If you are not very careful you will fall into this hole which isn't marked in any fashion by a navigation tool that marks everything else and your family or friends may lose you Leave a note and tell them where you went and don't worry you'll meet thousands of new friends down in that hole Finally I wrote chatted with the guy who wrote this good man and thanks for this jewel 
99_5300_4,EXCELLENT APP,Best app in the entire world
99_5301_4,Good app,This app has helped me control my phones battery usage 
99_5302_4,Battery Doctor,It's easy to use Keeps the battery conditioned for sure 
99_5303_4,Great app,Does what you need Monitor the cops Learn the lingo
99_5304_4,Me,Great app but I agree needs more coverage 
99_5305_4,I love it ,I love it I wish there were more feeds
99_5306_4,Yup,Nothing like listening in on big brother 
99_5307_4,So cool,This is so cool I love how many different frequencies there are to listen to 
99_5308_4,Love this App,Good Job 
99_5309_4,Great app ,This app works wonders Scans come out very clear and easy to send items One of my most used apps 
99_5310_4,I recommend,I use this app for completing my required expense report Stores pics so you can return to them pics are super clear I'd only wish for a two per page option as the scans come back a full page Overall only 2 Hell of an app 
99_5311_4,Great scanner,This is a great app 
99_5312_4,,my wouldnt b the same without it 
99_5313_4,Awesome D ,Best replacement app if your laptop is broken 
99_5314_4,Perfect ,Nuff said thanks for the update Works well for datpiff com
99_5315_4,Amazing app,If u know how to use the app then it's perfect in every way it does what it's supposed to Worth every penny
99_5316_4,One of the best Apps I've found,Really does what it says provides an amazing view of the heavens above your head 
99_5317_4,No regrets,Worth every penny I spent 
99_5318_4,Amaizing APP WOW I love it,No words just I love it definetely 3 very good invested 
99_5319_4,Education,This is a great educational app for students especially the movies It provides a great visual for abstract content 
99_5320_4,Blows My Mind,I finally found my old 3D glasses and took a look at this app again WOW A thing of beauty Mesmerizing 
99_5321_4,Great App,I've purchased 4 different swing apps This one is by far the best Great buy 
99_5322_4,I love it,One of the best ones 
99_5323_4,Love it,Since signing up I've lost 10 lbs in 2 weeks it's great
99_5324_4,Best from the best Believe me I spend to much money on this kind of apps No regrets ,Best 
99_5325_4,Office manager,Really like this app It has been soo very helpful in tracking with everything instantly accessible It really is amazing Having previously worked in the weight loss industry for many years I know that this is the key to planning and losing weight I am doing well with both 
99_5326_4,Audiobooks well worth it ,Simple to use Works flawlessly Loads of books to choose from I'm a fan 
99_5327_4,Treasure Island,Really enjoyed this reading Much better in the car than the junk on the radio 
99_5328_4,ibooks,Nice presentation Of course the books come from Librivox and the quality varies according to the talents of the volunteers I have found that most of them read well 
99_5329_4,And then some ,The interface works great and mapping is nice Only bug I've seen is Facebook integration at times 
99_5330_4,Chief Mapper at MTBikeAZ com,I've bee using EveryTrail com for years loving its ease and look for uploading my rides and embedding the maps on my blog I used the free app for a long time until recently on a trip I needed to find a trail and download it to use offline Enter EveryTrail Pro This app has practically replaced my GPS unit I adjust the GPS settings to extend battery life and I can go on epic rides and still have power to text my buddies photos from the trail I highly recommend it for on the fly trail mapping needs Worth every penny 
99_5331_4,Great app ,Just got it I'm sure it will be used often 
99_5332_4,Great app ,Helps so much with meal planning and grocery shopping Cuts time off of both those activities 
99_5333_4,Frankie Sal ,A must have if you like to cook I think it is great Have tried a baked chicken wing recipe and was almost like deep fried I'm from Buffalo NY so I know Like being able to save Recipes in recipe box on the app Get this app 
99_5334_4,Great ,Can't figure out how to modify add delete the main recipe folders and titles in the recipe box Please explain 
99_5335_4,Awsome,This app is amazing It has helped me so many times 
99_5336_4,Get it,Great in every way 
99_5337_4,Love this app,I love the pro version well worth the money I use it way more than the other cooking apps I have purchased 
99_5338_4,Awesome,So much fun
99_5339_4,AMAZING,It is such a helpful app People of all abilities will love it to help improve and learn 
99_5340_4,About the money,love the app but one more problem please cut down the prices on iWork to 3 99 dollars and the iLife apps to 1 99
99_5341_4,Fruit ninja,Great game this game is great to pass time
99_5342_4,Great app ,Helpful notations Wish the illustrations were a bit more defined 
99_5343_4,Very helpful,It's great for my anatomy class and I'm sure it'll be helpful in college
99_5344_4,Loved it,Well worth it Great tool for review and on the spur of the moment reference 
99_5346_4,PTA,Good basic muscle app worth the 
99_5347_4,Wanting MORE Awesome app,I actually believe this app is totally awesome in helping me prepare for my boards However just as the muscle name is given in audio I wish there was an option hearing all the muscles info in audio For me retaining info comes better in audio activities and constant quizzing 
99_5348_4,Delighted,I was very pleased with this app The graphics are excellent and the interface is very easy to use and navigate through The quiz options and video are a great bonus feature I am really satisfied especially for the price and look forward to trying out the other systems' software Nice Work 
99_5349_4,Best gReader App I've Found,Excellent app integrates well with Google Reader A must have app on all of my iDevices 
99_5350_4,Mr,Love app easy to use
99_5351_4,Great,This product does what it says 
99_5352_4,Awesome ap,Very helpful in planning trip 
99_5353_4,Great app ,I love this app because it gives you lots of great ideas for your home 
99_5354_4,update iPad secrets,update done for August and not working Why
99_5355_4,Excellent Tool For Newbies ,A real lifesaver and eye opener for this iPad newbie I learned so much from this app Information is well written and easy to understand Just wish my brain could retain it all for instant recall 
99_5356_4,iPad tips Secrets,Nice 
99_5357_4,Great app,Did not give 5 stars because have found not all campgrounds are listed Sure is helpful though 99 5 of time Have used for gas reservations for camps restaurant locations low clearances Awesome 
99_5358_4,Wow ,I was shocked to find the app includes overhead clearances and one can filter that down to what they are worried about Looks to be very thorough I have not yet tried it on the road but I am amazed at what I can find by sitting her in my house I am a little concerned about how much functionality I will find in remote locations with no cell service Time will tell I may have to update my rating when that situation arises which will be in 4 weeks Happy camping everyone 
99_5359_4,Great app ,I love it every one should have it
99_5360_4,Bingo,When I was a second grader I kept loosing on the game Bingo When I play it I'm a winner Thank yyy yyy 
99_5361_4,Great Application,This application has been a lifesaver It actually remotely sinks with both my IPhone and IPad I love it 
99_5362_4,Great App ,Great idea and it works great too 
99_5363_4,It is The Best,I love it now i can make people look fat and it is so easy
99_5364_4,Amazing,I live this app so much It is really really funny I used it on my whole family and they just started laughing It is really fun to use when u r bored 
