Id,Subject,MainText
99_6359_4,rating,Best Excellent applove it
99_6360_4,rating,very good app no
99_6361_4,rating,Excellent Gr8 app
99_6362_4,rating,Great ok
99_6363_4,rating,Nice one
99_6364_4,rating,Love it Best application I've ever had
99_6365_4,rating,Very good Awesome
99_6366_4,rating,Wow Its an awesome app
99_6367_4,rating,How you
99_6368_4,rating,Nice app Nice apps Chat calling will be easier using this app Only one problem when using this app please fix the bugs
99_6369_4,rating,Very good Like a jet
99_6370_4,rating,Great At times even faster than ordinary sms
99_6371_4,rating,Ashu singapore Aat aa 22
99_6372_4,rating,Gun Good app
99_6373_4,rating,Brown Excelent
99_6374_4,rating,Wonderful application
99_6375_4,rating,Tony SGN3 No password if have sure five star
99_6376_4,rating,The best Messenger app ever
99_6377_4,rating,Samsung galaxy star It is best
99_6378_4,rating,Very effective efficient
99_6379_4,rating,Awesome app
99_6380_4,rating,Excellent 
99_6381_4,rating,Shubham kumar I like this app bcoz Its realy easy n so fstafter all it is d no1 messenger on android It is very quick n low datausageon my smsng galaxy y
99_6382_4,rating,love it
99_6383_4,rating,Superb
99_6384_4,rating,Love it Nice
99_6385_4,rating,Best I am always on whatsapp My only means of talking Its good Better than normal texting
99_6386_4,rating,80 It sometimes jam up
99_6387_4,rating,Good This is a simply awe app Needs no intro Must try 
99_6388_4,rating,HTC one Best social app ever Y 
99_6389_4,rating,Stay Connected
99_6390_4,rating,Rahul Good
99_6391_4,rating,Awesome app The best app I really enjoy chatting in watsapp 
99_6392_4,rating,Rodney Lawrence
99_6393_4,rating,Selemon 0509833560
99_6394_4,rating,Grt app Love it go on
99_6395_4,rating,Good but Good concept But wish it didn't steal all of your data
99_6396_4,rating,Nice Ver nicoo
99_6397_4,rating,muaaaah i love this appp
99_6398_4,rating,1oo Excellent
99_6399_4,rating,Cool Cool watsapp
99_6400_4,rating,Nothing
99_6401_4,rating,No 1 M loving it
99_6402_4,rating,Excellent THE BEST ONE
99_6403_4,rating,Its gud bt not excellent bt still I like because it give opportunity to people come closer
99_6404_4,rating,G G
99_6405_4,rating,Eazy to excess Great way to communute
99_6406_4,rating,Apung Ya
99_6407_4,rating,watdupp nt bad
99_6408_4,rating,GooD App Very user friendly
99_6410_4,rating,Cool Good
99_6411_4,rating,Best app to share thoughts ideas and different things and feelings Excellent way that connects to our family friends relatives and strangers too 
99_6412_4,rating,Useful Awesome application and useful Thank
99_6413_4,rating,Good Helpfullllll
99_6414_4,rating,Good Good app
99_6415_4,rating,Awsme app I juz love dis app its so easy nd free
99_6416_4,rating,Nice Wonderful like it
99_6417_4,rating,yes
99_6418_4,rating,Intrsting app
99_6419_4,rating,Datta
99_6420_4,rating, very bad
99_6421_4,rating,Love it I love it apps
99_6422_4,rating,This is AWSM No words marvrlous
99_6423_4,rating,Nice Nice application
99_6424_4,rating,Good Nice n user friendly
99_6425_4,rating,Abu Awesome app
99_6426_4,rating,Great Great
99_6427_4,rating,Hell yeah Now i can hang out with my friend
99_6428_4,rating,Connectable Awesome
99_6429_4,rating,Great app Great app
99_6430_4,rating,Awsm App Really a good app
99_6431_4,rating,It is best App ever
99_6432_4,rating,Best messenger in the world
99_6433_4,rating,Excellent messenger The best in the market
99_6434_4,rating,Hello Good evenings
99_6435_4,rating,It works nicely
99_6436_4,rating,Hiiiii
99_6437_4,rating,Nice Ossam
99_6438_4,rating,The best The best
99_6439_4,rating,Ok OK
99_6440_4,rating,Cool Yoyo
99_6441_4,rating,Watsappyvvvrnr Two good
99_6442_4,rating,Love this Ths the bst app
99_6443_4,rating,God is good Believe
99_6444_4,rating,good GOodsoft
99_6445_4,rating,Simply super
99_6446_4,rating,Gd Good
99_6447_4,rating,Nice 2 keep in touch Nice 2 keep in touch vth friends
99_6448_4,rating,Nyc app Wonderful app 
99_6449_4,rating,Xperia c Awesome
99_6450_4,rating,Excellent The best
99_6451_4,rating,Good Very good
99_6453_4,rating,Nice app Grt app connect with friends
99_6454_4,rating,Great app Very handy
99_6455_4,rating,Wow Awesome
99_6456_4,rating,Excellent Great
99_6457_4,rating,This is d cool apps forever
99_6458_4,rating,Best app Too gud
99_6459_4,rating,Watts up boys This is d best way to keep in touch with ur friends 24 hrs
99_6460_4,rating,Just nice app It was fine
99_6461_4,rating,Ral Good
99_6462_4,rating,Awesome I love this appit's so addictive 
99_6463_4,rating,Awesome I'M SO ADDICTED AHH
99_6464_4,rating,I love Pinterest Maybe a little too much But this app helps fuel my obsession so I love it too
99_6465_4,rating,Fun Love the creativity 
99_6466_4,rating,Love this app Love using this app to find fun foods and funny things to brighten up my day
99_6467_4,rating,Awesome I'm so addicted to pinterest 
99_6468_4,rating,Awesome Loving it Easy to use with good content
99_6469_4,rating,Love it Im supper hooked now looking for wedding dress and decorations for my moms wedding yaay excited
99_6470_4,rating, Great app Runs smoothly and gives you everything you expect from Pinterest
99_6471_4,rating,Just the greatest I LOVE pinterest I can spend hours and hours on it There is nothing I don't like about it 
99_6472_4,rating,Use it every day Never a problem
99_6473_4,rating,Great I love it I can see anything 
99_6474_4,rating,Love it This app is amazing it gives you ideas I love this app and I have no problems with this app 
99_6475_4,rating,Perfect Love this app
99_6476_4,rating,Sorry for the low score I love the great things you can find here But very discouraged when I go to do a something that I get advertisements for a ton of other stuff
99_6477_4,rating,Cool Good place to go if you need an idea for almost anything
99_6478_4,rating,Excellent Beautiful sharing of beautiful pictures ideas ideas Love Peace Thank you
99_6479_4,rating,Love it Love this app it's my favorite
99_6480_4,rating,Enjoy Love it Simple
99_6481_4,rating,Fun Enjoyed it 
99_6482_4,rating,Great Luv this app
99_6483_4,rating,Great Love pintrest And this app 
99_6484_4,rating,Good Good idea I dig it
99_6485_4,rating,Love the app Very easy to use no problems 
99_6486_4,rating,Cool It made my pinning more interesting Keep up the good work 
99_6487_4,rating,The best I love it 
99_6488_4,rating,Love it I use this app way too much haha
99_6489_4,rating,Would be Crashes or id rate 5 
99_6490_4,rating,Easy to use Not driven by advertising Always full of things that are interesting to me without chasing me or interrupting my enjoyment with endless advertising
99_6491_4,rating,Love it My friends I love this app 
99_6492_4,rating,Nice I love it 
99_6493_4,rating,5 star Always awesome ideas
99_6494_4,rating,Amazing Deserves ten stars 
99_6495_4,rating,Love it Ive never had any problems Uploads and searches are fine
99_6496_4,rating,Love it Great app Which there was a way to multi check pins When editing deleting or moving to another board rather than having to do it one at a time
99_6497_4,rating,Pinterest Pinterest test
99_6498_4,rating,Great I love pinterest and the mobile app is great I almost never have issues with pinterest
99_6499_4,rating,Fun relaxing time Just plain fun
99_6500_4,rating,Because it is
99_6501_4,rating,Amazing This is utterly addicting love it
99_6502_4,rating,Awesome Such a delight to use
99_6503_4,rating,great i love it
99_6504_4,rating,Awesome app Super easy to use Fantastic resources 
99_6505_4,rating,Awesome Awesome I absolutely love this app 
99_6506_4,rating,Great addicted 
99_6507_4,rating, This app finds everything ur lookin for Its amazing and its just what u want to c wen all else fails on google
99_6508_4,rating,Brilliant Love this app Samsung Galaxy S3 Mini
99_6509_4,rating,Excellent A great app
99_6510_4,rating,The best Pinterest it's my favorite app I check out several times a day and always find great ideas Thanks 
99_6511_4,rating,Cool I'd always heard about pinterest but I never really good into it at all because I didn't understand it I understand it now and it's really very fun to find things snag pin them Also pinning things from all over the internet
99_6512_4,rating,Love it Love it
99_6513_4,rating,I like I like it's verrryyy nice 
99_6514_4,rating, I love it a lot less messy and much convenient than a real bulletin board or scrapbook
99_6515_4,rating, it Me and kids adore pinterest They have a lot of room ideas for my girls And help me with ideas for parties and all kinds of gathering and celebrations Also lets me post my crafty side and get more feedback Thanks pinterest 
99_6516_4,rating,Pinterest freak I'm addicted to pinterest
99_6517_4,rating,good excellent for photo GREAT
99_6518_4,rating,Pinterest I love this site
99_6519_4,rating,What an amazing app So many ideas and inspirations love it 
99_6520_4,rating,One Of My Favorite Apps I wasn't sure in the beginning But now I love spending time on Pinterest I have learned a lot and have developed new interests
99_6521_4,rating,Brilliant Good
99_6522_4,rating,I love it It's a place for me to see fandom stuff and funny photos
99_6523_4,rating,Love it You can search just about anything pin it and go back to it later
99_6524_4,rating,Love it Use it all the time
99_6525_4,rating,Very useful Enjoy using it
99_6526_4,rating,Inspiring Collecting your favorite things is fun to do as well as trying to express your likes and interests to others
99_6527_4,rating,Love What else can you say simply put this is a wonderful awesome app filled with awesomeness 
99_6528_4,rating,Yay Love it
99_6529_4,rating,Awesome Great
99_6530_4,rating,Love love love Pintrest uh maze ing 
99_6531_4,rating,Love love Great for everything Feeds my brain awesome ideas
99_6532_4,rating,Perfect Absolutely my favorite app 
99_6533_4,rating,Love on Pinterest Best app ever If you love cooking crafting fashion need cleaning or organizational ideas You will love this app Join now and Happy Pinning
99_6534_4,rating,Great Love this app 
99_6535_4,rating,Awesome There are billions of ideas to copy or take and add your own spin to it
99_6536_4,rating,Super useful From the fashion to the DIY anything you might need want to try is on here super super useful
99_6537_4,rating, It's so good 
99_6538_4,rating,Amazing IloveIttttt
99_6539_4,rating,Awesome Loving every second of it
99_6540_4,rating,I love this app Wow
99_6541_4,rating,Love it just bought a house I use this app for everything Its addictive 
99_6542_4,rating,Its awesome Its youre working
99_6543_4,rating,If you can't beat them join them Great place to find interesting images and to lose a few hours a day
99_6544_4,rating,Wonderful App Galaxy Note 3 user What a wonderful app My favorite by far Especially for single full time dad's that need ideas and projects to help keep my son and i busy
99_6545_4,rating,Valuable and fun I learn so much have fun and it is totally addicting 
99_6546_4,rating,Great place There are so many varieties of options to go through on this site Nice to have access to all of it
99_6547_4,rating,love it super convenient having all of my recipes tips crafts diy at my fingertips 
99_6548_4,rating,Love this app It's quick when i pin something it goes up immediately Can't live with out it
99_6549_4,rating,Love it Good ideas and you can find whatever u need for any occasion
99_6550_4,rating,Addicted at times Love it 
99_6551_4,rating,Love it Great Thanks
99_6552_4,rating,Best App Ever Inspiration and ideas from around the globe
99_6553_4,rating,Awsome Awsome
99_6554_4,rating,Love it Keep up the good work
99_6555_4,rating,Perfect I love pinterest Pinterest helped me plan for my wedding 
99_6556_4,rating,I love it Easy to use
99_6557_4,rating,V good V good
99_6558_4,rating,I m really eexcited Can't wait to see what you have
99_6559_4,rating,Just great Full of interesting and funny things 
99_6560_4,rating,YES Best app since sliced bread
99_6561_4,rating,5star Love App
99_6562_4,rating,Such a useful invention Great fun to use with so many things to discover
99_6563_4,rating,Nice app Raw
99_6564_4,rating,I love this app I use pinterest as my virtual closet XoxO
99_6565_4,rating,Love it Love pinterest 
99_6566_4,rating,Love it I use this app constantly
99_6567_4,rating,Great Ap Love this Ap it works great and I get all kinds of wonderful ideas from amazing People
99_6568_4,rating,Amazing app Love it D Fully like an online scrap board Awesome idea 
99_6569_4,rating,Great Totally awesome I am a pinterest addict sooo this is definitely a fantastic app 
99_6570_4,rating,Love it I am addicted 
99_6571_4,rating,So many ideas A network of inspiration 
99_6572_4,rating,Excellent for keeping visual ideas I really use this to keep recipes and fashion ideas but overall great app
99_6573_4,rating,Used to be great Now I cannot see anything from the people or boards I'm following Pretty frustrating
99_6574_4,rating,Really fun A few small glitches when loading some pins but other than that no problems HTC 4G android Update I'm using a Samsung galaxy S4 now and pinterest is still great I wish I could make more adjustments from my phone but I still have to use the regular laptop to change pin cover photos and to rearrange boards
99_6575_4,rating,Love it I'm addicted to diy
99_6576_4,rating,Excellent Love it 
99_6577_4,rating,Love Pinterest One of my favorite social media channels and this app lets me have most of it's functions but I've been getting lags and errors lately Plus can you add the function like Twitter to switch between accounts Cheers 
99_6578_4,rating,I'm addicted to this app Love it Getting this app is my best decision ever It's great 
99_6579_4,rating,Nice app Anything your looking 4 is here
99_6580_4,rating,In love Love to pin
99_6581_4,rating,Yay It's like having a little scrapbook in your pocket So much fun 
99_6582_4,rating,Absolutely addictive Amazing app don't know what I'd do without it now
99_6583_4,rating,Lovely app I love this app U can find anything
99_6584_4,rating, 3 3 3 love Love LOVE 
99_6585_4,rating,Love it Great app but a lot of repeated items
99_6586_4,rating,I love all the great things I find and the ease of pinning them 
99_6587_4,rating,Pinerest app I hope this works
99_6588_4,rating,Pinterest rocks A great place to chill I just love it 
99_6589_4,rating,Eh It stops suddenly kicks me out And I have to load it because its the ONLY way I can use it on my phones browser which isn't the mobile site anymore All tiny like the app Not as appealing as it was when it started out
99_6590_4,rating,Great This so is awesome great app that lets you share ideas and things you like
99_6591_4,rating,Some technical issues still need resolving Otherwise it's 1010
99_6592_4,rating,Julie Robin Life changer
99_6593_4,rating,all in one spot From hair styles to do it yourself ideas fashion ideas to quotes It's all in one spot It's wonderful 
99_6594_4,rating,I'm back Pinning 
99_6595_4,rating,Love it One off my favorites go here all the time Great ideas for everything
99_6596_4,rating,Happy Girl At last Been waiting for this app And now i have it i am very pleased Much easier to navigate
99_6597_4,rating,Love it 
99_6598_4,rating,Love it Im obsessed with this app i go on it everydaythere are so many ideas on a budget things to keep me busy
99_6599_4,rating,Love it It's such a wonderful site I can find anything I want Love that it's so much easier to use on my phone now also
99_6600_4,rating,Great Luv it App works excellent No issues at all
99_6601_4,rating,PINTEREST I have an addiction for this App This is the BEST Thank you so much for this wonderful Application For smartphone works wonderful I have no problems whatsoever Keep up the good work guys
99_6602_4,rating,Pinterest Luv this app This app is one of my favorite apps
99_6603_4,rating,Love it Very addicting you can get lost for houra 
99_6604_4,rating,Love love love this app Thanks
99_6605_4,rating,Perfect 3 I love this app so much so simple to use I adore it 3
99_6606_4,rating,Addictive I have to watch when I go on this as I can not get off 
99_6607_4,rating,Gr8 Gr8 
99_6608_4,rating,Stacey Thanks you are awesome
99_6609_4,rating,Love it This is a great app and i
99_6610_4,rating,5 EXCELLENTE
99_6611_4,rating,Cannot stahp I never leave this site Ever
99_6612_4,rating,Love it Addictive and useful Just not enough hours in the day 
99_6613_4,rating,Pretty awesome Liked everything about it Wish there was a way to save some of the photos though
99_6614_4,rating,Love it Perfect and so easy to use
99_6615_4,rating,Love this app Super simple layout and easy to use on mobile device Happy with the updates especially the quick pin and like capability 
99_6616_4,rating,Awesome Love it for my kitchen and garden
99_6617_4,rating,Wonderful App Very addictive and a lot of fun Get to share some really cool pictures ideas jokes and recipes
99_6618_4,rating,Great ideas One of my fav apps
99_6619_4,rating,Stella Love it So addictive
99_6620_4,rating,Loved it I loved it but it took up way to much space
99_6621_4,rating,Very easy to use and very helpful So cool
99_6622_4,rating,Love pinning Very good app
99_6623_4,rating,Gud It helps to bring out creativity within us 
99_6624_4,rating,Great tool I use this to organize my life
99_6625_4,rating,Love pinterest App is okay
99_6626_4,rating,Love pinterest Love it only downside is the quality of the pictures are a lot lower on the app than the website when used on computers
99_6627_4,rating,The best site ever
99_6628_4,rating,Addicted
99_6629_4,rating,Love pinterest I'm addicted 
99_6630_4,rating,Amazed
99_6631_4,rating,Great app I am so addicted to pinning on my 20 boards
99_6632_4,rating,Amazing Love it
99_6633_4,rating,Best app ever Love it
99_6634_4,rating,Good application Thank you
99_6635_4,rating,So helpful Love love it 
99_6636_4,rating,Love it 
99_6637_4,rating,Abdolutely love
99_6638_4,rating,Niceapp Pin pin pin
99_6639_4,rating,I love this app and could not live without it
99_6640_4,rating,Love it I love everything about the pinterest app The only thing it's missing is being able to change the cover photos on the boards
99_6641_4,rating,Awesome Love it from the gate If you're thinking rather you should or not Just do it You shall not be disappointed Big Brian Clearwater FL
99_6642_4,rating,Great sharing Love to be able to search and find exactly what I want Also makes preparing a menu easier It's awesome to have exactly what I have pinned all organized just for me 
99_6643_4,rating,I love it 
99_6644_4,rating,Good Easy to use
99_6645_4,rating,Awesome Love this app Some of the updates are annoying but it's still great
99_6646_4,rating,Jfk702 Great apps to share thought and pic
99_6647_4,rating,One of my favourite if not the favourite social networking sites Use it every day to find and store lots of interesting and lovely things
99_6648_4,rating,Awesomeness GR8 APP 
99_6649_4,rating,Very cool Very awesome I can look how to do my hair and painting nails u should all get this app
99_6650_4,rating,Love it 
99_6651_4,rating,Addicted Excellent place for a little bit of everything 
99_6652_4,rating,Inspirational
99_6653_4,rating,Amazing I love this app I'm addicted Its so fun There's nothing I would change 
99_6654_4,rating,LOVE IT D
99_6655_4,rating,So addictive Love love love 
99_6656_4,rating,Addict I get on pinterest and suddenly an hour has disappeared
99_6657_4,rating,Love Love it 
99_6658_4,rating,Excellent App Love this app 
99_6659_4,rating,Awesome I love pinterest its a place where I can keep all the things I like and are interested in in one place
99_6660_4,rating,I love this app anything u want to see or learn is right here Love the people who post
99_6661_4,rating,Love the info pics and people Love it
99_6662_4,rating,Love it Great app
99_6663_4,rating,Love it I really enjoy spending some time with pinterest I have learned a lot The site gets my creative juices flowing
99_6664_4,rating,Great Great ideas for all kinds of things Check it everyday for new things I wanna make
99_6665_4,rating,Still great as always Love it
99_6666_4,rating,Love this app Sometimes I get lost with time because it is so addicting It is so fun to look at everything and pin your likes or needs to your own boards I also use a lot of the ideas I get from Pinterest in my classroom and I have used DIY ideas for my home 
99_6667_4,rating,I love this app just wish it was available for every site i visited Would recommend
99_6668_4,rating,Amazing Highly addictive 
99_6669_4,rating,Great Love it Addicting to
99_6670_4,rating,Awesome I love this app so much I do wish I could change my board cover and have more categories like on the website
99_6671_4,rating,Love My favorite app
99_6672_4,rating,The best Love this app has everything you need
99_6673_4,rating,I love this app There is so much to see and learn on this app that I just can't get enough of it I could spend hours each day
99_6674_4,rating,Great LOVE LOVE Pinterest
99_6675_4,rating,This app sucks
99_6676_4,rating,Amazing The best app I have 
99_6677_4,rating,Love this app
99_6678_4,rating,Love this app easy to use 
99_6679_4,rating,I'd rather be Pinning It has taken me from that looks coolto LOOK WHAT I MADE 
99_6680_4,rating,No bugs
99_6681_4,rating,Love it it keeps me busy
99_6682_4,rating,Best app ever Use it every day all the time 
99_6683_4,rating,Brilliant 
99_6684_4,rating,Pinterest Love This
99_6685_4,rating,Hai Gold
99_6686_4,rating,Love love love Pinterest 
99_6687_4,rating,Awesome Yes
99_6688_4,rating,Love LOVE this app I could spend hours on this app 
99_6689_4,rating,Good Works great Havent had and problems
99_6690_4,rating,Great app I love being able to use Pinterest on the go
99_6691_4,rating,Super like Luuuuuuuurrrrrve it 
99_6692_4,rating,Love 
99_6693_4,rating,Pin head I'm a pinterest addict and this fills my addiction on the go 
99_6694_4,rating,Pintrest I love tuis app it gives me ideas i would totaly recomend this app
99_6695_4,rating,Great for creatives and multitaskers So many ideas not enough time
99_6696_4,rating,My favorite app 
99_6697_4,rating,I love love love this app 
99_6698_4,rating,Very good Getting better with each update
99_6699_4,rating,i love this app everything you want to see is here
99_6700_4,rating,Best app Cute ideas forever 
99_6701_4,rating,Does what it says it does No complaints here
99_6702_4,rating,Love it So many wonderful ideas 
99_6703_4,rating,Love it Totally addicted 
99_6704_4,rating,Ideas for everything This app is great for artistic projects and other creative tasks
99_6705_4,rating,Awesome app Awesome app I teach and use it for work to find anchor charts and more
99_6706_4,rating,Great app I really love this app Very entertaining and educational
99_6707_4,rating,Fabulous I love having this app It always loads quickly and runs great
99_6708_4,rating,Love this
99_6709_4,rating, Love it
99_6710_4,rating,I love the pinterest app I'm still learning the functions but pleased overall Great app
99_6711_4,rating,Nicee Really nice application I love to use it 
99_6712_4,rating,Great app This is the best Everything works really great I highly recommend this app 
99_6713_4,rating,Love it Amazing app for amazing website Good job 
99_6714_4,rating,Love it Such inspiration Pinterest is highly addictive and dont know that I could survive without it now jk of course But seriously very great app Lots of USEFUL information and creative ideas And to boot its a free app to enjoy endlessly No tech problems Just superb through and through 
99_6715_4,rating,Endless entertainment
99_6716_4,rating,I honestly love everything about this Im very glad it allows me to basically look up how to do pretty much everything It comes in handy 
99_6717_4,rating,Love it So addicting 
99_6718_4,rating,Excellent Love Love Love I have so many new recipes and design ideas Its so fun to see what friends like and pin also
99_6719_4,rating,I actually like the app better than the online site
99_6720_4,rating,Addicted Simply can't stop browsing through before I wind my day 
99_6721_4,rating,Great Very Nice AppsLove it
99_6722_4,rating,Great especially when you are stuck in a boring meeting
99_6723_4,rating,Love It 
99_6724_4,rating,Lovely Funnest and most helpful app ever 
99_6725_4,rating,Love it MAKES MY DAY with all the love 
99_6726_4,rating,Excellent site You can't go wrong here However don't join if you don't have a few hours each day to kill Highly addictive 
99_6727_4,rating,Matters of Interest Simple to use Easy setup
99_6728_4,rating,Galaxy tab 3 Love pinterest app works well have it both on phone and tab
99_6729_4,rating,AWESOME 
99_6730_4,rating,Love it I'm addicted Plus everything I asked to fix has been fixed so thanks for listening to us and making your updates worth it 
99_6731_4,rating,GREAT APP Love this app
99_6732_4,rating,Informative Very Enjoyable 
99_6733_4,rating,Love it Awesome app
99_6734_4,rating,Everything anything and everything enough said 
99_6735_4,rating,AWESOME Never thought I'd be addicted to pinterest
99_6736_4,rating,Excellent Very useful
99_6737_4,rating,Lovelovelove obsessed 
99_6738_4,rating,Awesome app Everyone should use this app 
99_6739_4,rating,Great ap
99_6740_4,rating,Awesome Awesome thanks
99_6741_4,rating,The Best
99_6742_4,rating,Nice Cool
99_6743_4,rating,Love it I love this app It lets me edit my pics anyway I want and share them easily Definitely a 5 star app 
99_6744_4,rating,Super app I really like it
99_6745_4,rating,Excellent Great app I have ever used
99_6746_4,rating,Ayeee This app is awesome
99_6747_4,rating,Really good Glad downloaded
99_6748_4,rating,Perfect Love This So Much 
99_6749_4,rating,Excellent app Best photography app till date 
99_6750_4,rating,p p
99_6751_4,rating,Like it Great app
99_6752_4,rating,Yes Awesome
99_6753_4,rating,Nice I love this aap
99_6754_4,rating,Best Great
99_6755_4,rating,DJ super
99_6756_4,rating,Excellent Love it
99_6757_4,rating,milla super
99_6758_4,rating,Wow Awsome 
99_6759_4,rating,Excellent Cool
99_6760_4,rating,Wow Love this app
